{
  "schemaVersion": 2,
  "reportId": "s_a56e685a51b84bf0b0fd0c6bc5e89389",
  "cusaId": "CUSA01715",
  "testedAt": "2026-10-11T04:48:53.897104Z",
  "status": "nothing",
  "game": {
    "version": "01.02",
    "region": "Europe"
  },
  "release": {
    "tag": "v0.2.4",
    "commit": "cca3d2dd730509f50b85676ed4f1164280cd1484"
  },
  "device": {
    "manufacturer": "OPPO",
    "model": "CPH2731",
    "socId": "sm8735",
    "socName": "Snapdragon 8s Gen 4",
    "gpu": "Adreno 825",
    "androidVersion": "16",
    "ramBucketGb": 8
  },
  "driver": {
    "id": "turnip-ee5dda7a5c67966f",
    "type": "turnip",
    "name": "Turnip mojo-26.1 v2",
    "version": "mojo-26.1-v2",
    "build": "26.1.0",
    "source": "JICA98/bachata-s4-drivers mojo-26.1-v2"
  },
  "config": {
    "settings": {
      "general.big_core_affinity": true,
      "general.neo_mode": false,
      "gpu.copy_gpu_buffers": false,
      "gpu.dump_shaders": false,
      "gpu.readbacks_mode": 0,
      "gpu.vblank_frequency": 60,
      "gpu.internal_screen_width": 1280,
      "gpu.internal_screen_height": 720,
      "gpu.present_rb_swap": false,
      "vulkan.vkcrash_diagnostic_enabled": false
    },
    "requiredOverrides": {
      "general.big_core_affinity": true,
      "gpu.readbacks_mode": 0
    },
    "driverId": "turnip-ee5dda7a5c67966f",
    "guestBackend": "FEX",
    "frameGenerationMode": "OFF",
    "fexPreset": "PERFORMANCE",
    "adrenoTurboMode": true,
    "bigCoreAffinity": true,
    "maliGpuOptimizations": false
  },
  "patches": [],
  "result": {
    "summary": "CUSA01715: session ended at SESSION_STOPPING; exit code 133. No game frame was reached.",
    "notes": "",
    "issues": []
  },
  "contributor": {
    "publicId": "tester-128266f2d30a"
  },
  "provenance": {
    "captureType": "app-captured",
    "appBuild": "0.2.4"
  },
  "evidence": {
    "screenshots": [],
    "diagnostics": [
      {
        "path": "assets/CUSA01715/s_a56e685a51b84bf0b0fd0c6bc5e89389/logs/01-application.log.gz",
        "sha256": "6b1a69afbc53d1342ae580e7ae28e6473e9198752a8c298a80e4ca1f3c819109",
        "label": "Bachata application log"
      },
      {
        "path": "assets/CUSA01715/s_a56e685a51b84bf0b0fd0c6bc5e89389/logs/02-shadps4.log.gz",
        "sha256": "422cad117b7f85c739b226224ec9ec993cf0e24d035d04231e2cdde199d5025a",
        "label": "shadPS4 session log"
      }
    ]
  }
}
