{
  "schemaVersion": 2,
  "reportId": "s_66acd01eb73a4f59812dbfeeb5ee4d4b",
  "cusaId": "CUSA00068",
  "testedAt": "2026-10-12T13:54:14.835059Z",
  "status": "boots",
  "game": {
    "version": "01.10",
    "region": "North America"
  },
  "release": {
    "tag": "v0.2.4",
    "commit": "cca3d2dd730509f50b85676ed4f1164280cd1484"
  },
  "device": {
    "manufacturer": "Xiaomi",
    "model": "2311DRK48G",
    "socId": "mt6897",
    "socName": "MT6897",
    "gpu": "Unknown",
    "androidVersion": "16",
    "ramBucketGb": 12
  },
  "driver": {
    "id": "panvk-a1c25dfbc785cde8",
    "type": "turnip",
    "name": "PanVK V2",
    "version": "2.2.0",
    "build": "a1c25dfbc785cde8",
    "source": "Bachata-local/panvk-v2-g615-composed 2.2.0"
  },
  "config": {
    "settings": {
      "general.big_core_affinity": false,
      "general.neo_mode": false,
      "gpu.copy_gpu_buffers": false,
      "gpu.dump_shaders": false,
      "gpu.readbacks_mode": 0,
      "gpu.vblank_frequency": 60,
      "gpu.internal_screen_width": 1280,
      "gpu.internal_screen_height": 720,
      "gpu.present_rb_swap": false,
      "vulkan.vkcrash_diagnostic_enabled": false
    },
    "requiredOverrides": {
      "gpu.readbacks_mode": 0
    },
    "driverId": "panvk-a1c25dfbc785cde8",
    "guestBackend": "FEX",
    "frameGenerationMode": "OFF",
    "fexPreset": "SAFE",
    "adrenoTurboMode": false,
    "bigCoreAffinity": false,
    "maliGpuOptimizations": true
  },
  "patches": [],
  "result": {
    "summary": "CUSA00068: session ended at SESSION_STOPPING; exit code 133. A frame was rendered; further progress is unverified.",
    "notes": "",
    "issues": []
  },
  "contributor": {
    "publicId": "tester-81c435e6f5db"
  },
  "provenance": {
    "captureType": "app-captured",
    "appBuild": "0.2.4"
  },
  "evidence": {
    "screenshots": [],
    "diagnostics": [
      {
        "path": "assets/CUSA00068/s_66acd01eb73a4f59812dbfeeb5ee4d4b/logs/01-application.log.gz",
        "sha256": "f7da4680025616a5d5d0ba5d67982c769731e52c03e84502d5a7a10499500993",
        "label": "Bachata application log"
      },
      {
        "path": "assets/CUSA00068/s_66acd01eb73a4f59812dbfeeb5ee4d4b/logs/02-shadps4.log.gz",
        "sha256": "dad98204ac69d24d37ea0944e2104836d3af21d960f2396f36a2ec2f76210b70",
        "label": "shadPS4 session log"
      }
    ]
  }
}
