{
  "schemaVersion": 2,
  "reportId": "s_671e5545be55409fae94016b5985b3cb",
  "cusaId": "CUSA09415",
  "testedAt": "2026-10-18T13:06:56.971896Z",
  "status": "ingame",
  "game": {
    "version": "01.00",
    "region": "Europe"
  },
  "release": {
    "tag": "v0.2.5",
    "commit": "433c7f30a66c205dff5c3261431e550957f5d447"
  },
  "device": {
    "manufacturer": "motorola",
    "model": "motorola edge 30 pro",
    "socId": "sm8450",
    "socName": "SM8450",
    "gpu": "Unknown",
    "androidVersion": "14",
    "ramBucketGb": 12
  },
  "driver": {
    "id": "turnip-ee5dda7a5c67966f",
    "type": "turnip",
    "name": "Turnip mojo-26.1 v2",
    "version": "26.1.0",
    "build": "ee5dda7a5c67966f",
    "source": "JICA98/bachata-s4-drivers mojo-26.1-v2"
  },
  "config": {
    "settings": {
      "general.big_core_affinity": false,
      "general.neo_mode": false,
      "gpu.copy_gpu_buffers": false,
      "gpu.dump_shaders": false,
      "gpu.readbacks_mode": 0,
      "gpu.vblank_frequency": 60,
      "gpu.internal_screen_width": 1280,
      "gpu.internal_screen_height": 720,
      "gpu.present_rb_swap": false,
      "vulkan.vkcrash_diagnostic_enabled": false
    },
    "requiredOverrides": {
      "gpu.readbacks_mode": 0
    },
    "driverId": "turnip-ee5dda7a5c67966f",
    "guestBackend": "FEX",
    "frameGenerationMode": "OFF",
    "fexPreset": "DEFAULT",
    "adrenoTurboMode": false,
    "bigCoreAffinity": false,
    "maliGpuOptimizations": false
  },
  "patches": [],
  "result": {
    "summary": "Undertale: observed playable during this test session. Measured native FPS: 30.0. Recorded duration: 278s.",
    "notes": "",
    "issues": []
  },
  "contributor": {
    "publicId": "tester-02e9e1677922"
  },
  "provenance": {
    "captureType": "app-captured",
    "appBuild": "0.2.5"
  },
  "performance": {
    "nativeAverageFps": 29.95,
    "testDurationSeconds": 278,
    "framePacing": "smooth",
    "nativeOnePercentLowFps": 28.95
  },
  "evidence": {
    "screenshots": [
      {
        "path": "assets/CUSA09415/s_671e5545be55409fae94016b5985b3cb/screenshots/01.webp",
        "sha256": "1d787817038a24cdcac2590e78d8d97c9982927ae67740251996d1b51278ad2d",
        "caption": "Undertale — capture 1 · 2026-10-18T13:06:56.652Z"
      },
      {
        "path": "assets/CUSA09415/s_671e5545be55409fae94016b5985b3cb/screenshots/02.webp",
        "sha256": "fe1d645dad0a24f19e5c4b96a2d5f42be650075ec1b854c17d22a81def166d3a",
        "caption": "Undertale — capture 2 · 2026-10-18T13:08:18.320Z"
      },
      {
        "path": "assets/CUSA09415/s_671e5545be55409fae94016b5985b3cb/screenshots/03.webp",
        "sha256": "73b1774cc8f50f1352c8933fc6b88481535caa2aa19dbb608002c2314bbe0561",
        "caption": "Undertale — capture 3 · 2026-10-18T13:09:20.064Z"
      }
    ],
    "diagnostics": [
      {
        "path": "assets/CUSA09415/s_671e5545be55409fae94016b5985b3cb/logs/01-application.log.gz",
        "sha256": "c345293fdf2f4bfed19c0d2860770070f36e20f8693c49063f2e78fa3866cee3",
        "label": "Bachata application log"
      },
      {
        "path": "assets/CUSA09415/s_671e5545be55409fae94016b5985b3cb/logs/02-shadps4.log.gz",
        "sha256": "84d828449edbd704c66748e1171e18b9a4b4aaa920bfff2b8b8cd8c04c953603",
        "label": "shadPS4 session log"
      }
    ]
  }
}
