{
  "schemaVersion": 2,
  "reportId": "s_98dcf1e501934122aef9b3281d04475b",
  "cusaId": "CUSA18779",
  "testedAt": "2026-10-11T19:25:16.545955Z",
  "status": "nothing",
  "game": {
    "version": "Unknown",
    "region": "North America"
  },
  "release": {
    "tag": "v0.2.4",
    "commit": "cca3d2dd730509f50b85676ed4f1164280cd1484"
  },
  "device": {
    "manufacturer": "Xiaomi",
    "model": "2602BPC18G",
    "socId": "mt6991",
    "socName": "MT6991",
    "gpu": "Unknown",
    "androidVersion": "16",
    "ramBucketGb": 12
  },
  "driver": {
    "id": "panvk-a1c25dfbc785cde8",
    "type": "turnip",
    "name": "PanVK V2",
    "version": "2.2.0",
    "build": "a1c25dfbc785cde8",
    "source": "Bachata-local/panvk-v2-g615-composed 2.2.0"
  },
  "config": {
    "settings": {
      "general.big_core_affinity": false,
      "general.neo_mode": false,
      "gpu.copy_gpu_buffers": false,
      "gpu.dump_shaders": false,
      "gpu.readbacks_mode": 0,
      "gpu.vblank_frequency": 60,
      "gpu.internal_screen_width": 1280,
      "gpu.internal_screen_height": 720,
      "gpu.present_rb_swap": false,
      "vulkan.vkcrash_diagnostic_enabled": false
    },
    "requiredOverrides": {
      "gpu.readbacks_mode": 0
    },
    "driverId": "panvk-a1c25dfbc785cde8",
    "guestBackend": "FEX",
    "frameGenerationMode": "OFF",
    "fexPreset": "DEFAULT",
    "adrenoTurboMode": false,
    "bigCoreAffinity": false,
    "maliGpuOptimizations": true
  },
  "patches": [],
  "result": {
    "summary": "CUSA18779: session ended at SESSION_STOPPING; exit code 133. No game frame was reached.",
    "notes": "",
    "issues": []
  },
  "contributor": {
    "publicId": "tester-544f84c27448"
  },
  "provenance": {
    "captureType": "app-captured",
    "appBuild": "0.2.4"
  },
  "evidence": {
    "screenshots": [],
    "diagnostics": [
      {
        "path": "assets/CUSA18779/s_98dcf1e501934122aef9b3281d04475b/logs/01-application.log.gz",
        "sha256": "8b6d394bc829aad295033fa097dfad5f00c5d2c1074b37cf9ee90d042d05eff1",
        "label": "Bachata application log"
      },
      {
        "path": "assets/CUSA18779/s_98dcf1e501934122aef9b3281d04475b/logs/02-shadps4.log.gz",
        "sha256": "ab850b01e7f4843e478f2ed447c30578007eba88a3409476cea21b5269929b42",
        "label": "shadPS4 session log"
      }
    ]
  }
}
