{
  "schemaVersion": 2,
  "reportId": "s_4eb49a5773a3491bbfa55ca706f9e937",
  "cusaId": "CUSA01715",
  "testedAt": "2026-10-21T15:05:11.655629Z",
  "status": "nothing",
  "game": {
    "version": "01.02",
    "region": "Europe"
  },
  "release": {
    "tag": "v0.2.4",
    "commit": "cca3d2dd730509f50b85676ed4f1164280cd1484"
  },
  "device": {
    "manufacturer": "Xiaomi",
    "model": "2602BPC18I",
    "socId": "mt6991",
    "socName": "Dimensity 9400",
    "gpu": "Immortalis-G925",
    "androidVersion": "16",
    "ramBucketGb": 12
  },
  "driver": {
    "id": "panvk-a1c25dfbc785cde8",
    "type": "turnip",
    "name": "PanVK V2",
    "version": "2.2.0",
    "build": "a1c25dfbc785cde8",
    "source": "Bachata-local/panvk-v2-g615-composed 2.2.0"
  },
  "config": {
    "settings": {
      "general.big_core_affinity": true,
      "general.neo_mode": false,
      "gpu.copy_gpu_buffers": false,
      "gpu.dump_shaders": false,
      "gpu.readbacks_mode": 0,
      "gpu.vblank_frequency": 60,
      "gpu.internal_screen_width": 1280,
      "gpu.internal_screen_height": 720,
      "gpu.present_rb_swap": false,
      "vulkan.vkcrash_diagnostic_enabled": false
    },
    "requiredOverrides": {
      "general.big_core_affinity": true,
      "gpu.readbacks_mode": 0
    },
    "driverId": "panvk-a1c25dfbc785cde8",
    "guestBackend": "FEX",
    "frameGenerationMode": "OFF",
    "fexPreset": "PERFORMANCE",
    "adrenoTurboMode": false,
    "bigCoreAffinity": true,
    "maliGpuOptimizations": true
  },
  "patches": [
    {
      "id": "disable-bloom",
      "revision": "2026.10.01.13399220021802570842"
    },
    {
      "id": "disable-depth-of-field",
      "revision": "2026.10.01.13399220021802570842"
    },
    {
      "id": "disable-motion-blur",
      "revision": "2026.10.01.13399220021802570842"
    },
    {
      "id": "disable-soft-particles",
      "revision": "2026.10.01.13399220021802570842"
    },
    {
      "id": "disable-ssao",
      "revision": "2026.10.01.13399220021802570842"
    },
    {
      "id": "resolution-patch-960x540",
      "revision": "2026.10.01.13399220021802570842"
    }
  ],
  "result": {
    "summary": "CUSA01715: session ended at SESSION_STOPPING; exit code 135. A frame was rendered; further progress is unverified.",
    "notes": "",
    "issues": []
  },
  "contributor": {
    "publicId": "tester-3e9d0bd01a33"
  },
  "provenance": {
    "captureType": "app-captured",
    "appBuild": "0.2.4"
  },
  "evidence": {
    "screenshots": [],
    "diagnostics": [
      {
        "path": "assets/CUSA01715/s_4eb49a5773a3491bbfa55ca706f9e937/logs/01-application.log.gz",
        "sha256": "3280fc1e92b24019ae35b9eb506541d0ddc2cc56a4ba8f411689e65f54297fa0",
        "label": "Bachata application log"
      },
      {
        "path": "assets/CUSA01715/s_4eb49a5773a3491bbfa55ca706f9e937/logs/02-shadps4.log.gz",
        "sha256": "c3c3afc91df64b87e8616a026feb2f6faab6965932c101c4be1fad4fb7ca6c8a",
        "label": "shadPS4 session log"
      }
    ]
  }
}
